{
  "analyticsEventContractVersion": "2",
  "batchId": "batch_mixed_001",
  "receivedAt": "2026-07-26T12:05:00.000Z",
  "results": [
    {
      "eventId": "event_placement_requested_001",
      "status": "accepted"
    },
    {
      "eventId": "event_purchase_started_001",
      "status": "duplicate"
    },
    {
      "eventId": "event_invalid_authority_001",
      "status": "permanently_rejected",
      "code": "authority_not_allowed"
    },
    {
      "eventId": "event_restore_completed_001",
      "status": "retryable",
      "code": "storage_temporarily_unavailable",
      "retryAfterSeconds": 10
    }
  ]
}
